6.83214,47.72206,"max@70","GIROMAGNY VERS BELFORT RD465"
4.32084,47.00845,"max@70","DOUBLE SENS RD681"
8.80249,42.56163,"max@70","DOUBLE SENS RT30"
-0.55508,45.55669,"max@70","DOUBLE SENS RD137"
7.1026,43.66,"max@70","ROQUEFORT LES PINS vers VILLENEUVE LOUBET RD2085"
5.4696,45.78,"max@70","DOUBLE SENS RD19"
0.3358,46.555,"max@70","VOUNEUIL SOUS BIARD VERS LES COURONNERIES RD162"
0.34,46.816,"max@70","CHÂTELLERAULT vers LENCLOÎTRE RD725"
0.839839,46.416236,"max@70","LUSSAC LES CHATEAUX vers MONTMORILLON RD727"
2.9212,42.623,"max@70","DOUBLE SENS RD8"
-1.3675,43.492,"max@70","DOUBLE SENS RD261"
3.1192,45.762,"max@70","CLERMONT FERRAND vers AUBIERE RD 2099"
2.6978,45.604,"max@70","ROCHEFORT MONTAGNE vers TAUVES RD922"
-1.5681,48.804,"max@70","ST PAIR SUR MER vers JULLOUVILLE RD911"
1.1599,48.771,"max@70","DREUX vers VERNEUIL SUR AVRE RN12"
6.5753,44.645,"max@70","GAP vers BRIANCON RN94"
6.1607,44.506,"max@70","DOUBLE SENS RD942"
2.39078,43.89822,"max@70","DOUBLE SENS RD999"
2.41687,50.75638,"max@70","RENESCURE vers CASSEL RD933"
2.4193,50.758,"max@70","CASSEL vers RENESCURE RD933"
4.948,43.932,"max@70","CAUMONT SUR DURANCE vers VEDENE RD6"
0.303,49.095,"max@70","DOUBLE SENS RD519"
1.8503,49.281,"max@70","DOUBLE SENS RD923"
0.9601,46.164,"max@70","LIMOGES vers POITIERS RN147"
4.846,45.716,"max@70","BRON vers ST FONS RD383"
0.1085,43.276,"max@70","Tarbes vers Auch RN21"
5.5848,46.714,"max@70","DOUBLE SENS RD70"
-2.1059,48.593,"max@70","DOUBLE SENS RD168"
-1.7913,48.059,"max@70","DOUBLE SENS RD34"
0.6188,43.017,"max@70","DOUBLE SENS RN125"
0.63,42.99,"max@70","DOUBLE SENS RN125"
5.0013,47.27,"max@70","BEAUNE VERS DIJON RD974"
2.89519,49.18454,"max@70","SOISSONS VERS PARIS RN2"
2.268784,48.866458,"max@70","Porte de la Muette vers Porte Maillot Bd Périphérique Intérieur - Porte Dauphine"
2.3688,48.818,"max@70","Porte d'Italie vers Quai d'Ivry Porte d'Ivry - BP extérieur (13ième)"
4.78,45.248,"max@70","DOUBLE SENS RD82"
9.5466,42.257,"max@70","PORTO VECCHIO vers BASTIA RN198"
9.5489,42.266,"max@70","BASTIA vers PORTO VECCHIO RN198"
8.7545,42.041,"max@70","AJACCIO vers CARGESE RD81"
3.713,47.918,"max@70","St Florentin vers Auxerre RN77"
6.61068,43.23483,"max@70","DOUBLE SENS RD61"
1.3594,44.056,"max@70","DOUBLE SENS RD959"
2.4143455,48.8456914,"max@70","Porte Dorée vers Porte de Montreuil Porte de Vincennes - BP extérieur (12ième)"
2.2988,48.826,"max@70","PORTE DE CHATILLON vers PORTE DE VERSAILLES BP intérieur - Porte de Vanves/Brancion"
2.3748344,48.900368,"max@70","Porte de la Villette vers la Porte de la Chapelle Porte d'Aubervilliers - BP extérieur (19ième)"
2.4131827,48.869597,"max@70","Porte du Pré St Gervais vers Porte de Bagnolet Sortie tunnel des Lilas - BP intérieur (20ième)"
2.361351,48.900701,"max@70","Porte de Clignancourt vers Porte d'Aubervilliers Porte de la Chapelle (18ième) BP intérieur"
4.9407,46.557,"max@70","Cuisery vers Lacrost RD975"
1.73588,47.85058,"max@70","MEUNG SUR LOIRE vers ORLEANS RD2152"
1.097518,47.030514,"max@70","DOUBLE SENS RD943"
5.7538,45.066,"max@70","DOUBLE SENS RN85"
-3.0673,48.579,"max@70","Lanvollon vers Guingamp RD9"
-2.0863,48.388,"max@70","Caulnes vers Dinan RD766"
2.9186,43.306,"max@70","DOUBLE SENS RD5"
-0.53338,47.46958,"max@70","ANCENIS VERS NANTES RD723"
3.7726,46.304,"max@70","DOUBLE SENS RD994"
-1.1068,44.452,"max@70","DOUBLE SENS RD652"
-53.99413,5.48704,"max@70","DOUBLE SENS RN1"
-52.37054,4.90992,"max@70","DOUBLE SENS RN1"
4.4104,45.42,"max@70","ST CHAMOND vers FIRMINY RN88"
5.89372,48.65087,"max@70","Moutrot vers Toul RD674"
-1.6336,49.6294,"max@70","LES PIEUX vers CHERBOURG EN COTENTIN Bd de l'Atlantique"
0.896,47.214,"max@70","Tours vers Loches RD943"
1.4669,48.485,"max@70","DOUBLE SENS RN1154"
2.67996,49.14561,"max@70","DOUBLE SENS RN330"
1.2436,43.182,"max@70","FOIX vers MONTESQUIEU VOLVESTRE RD628"
7.65873,48.52462,"max@70","COLMAR VERS STRASBOURG A35"
6.25291,46.15197,"max@70","PERS-JUSSY vers ANNEMASSE RD2"
6.13981,48.68305,"max@70","VILLERS LES NANCY vers LAXOU Av. Bois Gronée 477m après carrefour Rue Mareville"
7.19763,43.68589,"max@70","NICE VERS DIGNE LES BAINS RD6202"
2.09794,49.01956,"max@70","VERSAILLES VERS BEAUVAIS RN184"
0.14471,45.63948,"max@70","MA CAMPAGNE VERS CENTRE VILLE VOIE DE L'EUROPE (VC E130)"
5.4222,43.55367,"max@70","DOUBLE SENS RD7N"
-0.7707,48.05884,"max@70","Rennes vers Le Mans RD57"
9.36523,42.50639,"max@70","CORTE vers BASTIA RN193"
9.38193,42.51095,"max@70","BASTIA vers CORTE RN193"
2.50874,46.99612,"max@70","DOUBLE SENS RD2076"
4.30617,45.3689,"max@70","DOUBLE SENS RD500"
4.54473,45.86772,"max@70","TARARE vers LYON RN7"
-0.90195,47.07068,"max@70","ANGERS VERS NANTES RD13"
3.60491,47.7403,"max@70","Avallon vers Auxerre RD606"
0.97073,47.67022,"max@70","DOUBLE SENS RN10"
1.89152,48.72478,"max@70","RAMBOUILLET VERS PARIS RN10"
3.15843,45.94626,"max@70","Riom vers Gannat RD2009"
-0.77082,48.05891,"max@70","Le Mans vers Rennes RD57"
5.99465,47.20167,"max@70","DOUBLE SENS RN83"
1.24402,44.86983,"max@70","DOUBLE SENS RD704"
9.39676,41.95942,"max@70","Bastia vers Bonifacio RT10"
-0.23823,48.88638,"max@70","PONT D OUILLY VERS FALAISE RD511"
-0.18859,49.23979,"max@70","DOUBLE SENS RD513"
-0.48917,48.91197,"max@70","CONDE SUR NOIREAU VERS CAEN RD562"
-0.51502,49.17677,"max@70","TILLY SUR SEULLES VERS CARPIQUET RD9"
7.18412,43.65772,"max@70","CAGNES SUR MER VERS NICE ROUTE DU BORD DE MER"
-60.97556,14.7458,"max@70","DOUBLE SENS RN1"
-61.62941,16.2083,"max@70","DOUBLE SENS RD23"
-61.48272,16.21694,"max@70","DOUBLE SENS RN4"
2.33759,48.81114,"max@70","Province vers Paris A6a"
2.62209,46.31823,"max@70","DOUBLE SENS RD2144"
4.4055,45.41628,"max@70","FIRMINY vers ST CHAMOND RN88"
0.4393,47.30555,"max@70","DOUBLE SENS RD7"
9.50569,42.58693,"max@70","LUCCIANA VERS BIGUGLIA RTE DU CORDON LAGUNAIRE DE LA MARANA, HAUTEUR CCAS"
4.65451,44.70522,"max@70","DOUBLE SENS RD2"
4.29686,44.659,"max@70","AUBENAS vers LE PUY EN VELAY RN102"
2.4154,49.0886,"max@70","PARIS vers PROVINCE RD316"
2.06125,48.94527,"max@70","Achères vers Poissy RD30"
2.47448,48.88166,"max@70","Nogent vers A3 A86"
3.09993,47.0018,"max@70","Nevers vers Fourchambault RD40"
3.11778,46.99567,"max@70","Fourchambault vers Nevers RD40"
7.18503,43.65794,"max@70","NICE VERS CAGNES SUR MER ROUTE DU BORD DE MER"
-1.13328,48.58703,"max@70","DUCEY VERS ST HILAIRE DU HARCOUET RD976"
6.26485,44.00963,"max@70","DOUBLE SENS RN85"
-61.60533,15.99802,"max@70","Basse-Terre vers Pointe-à-Pitre RN1"
5.55336,43.64404,"max@70","DOUBLE SENS RD96"
-60.87277,14.59527,"max@70","DOUBLE SENS RN6"
-1.64994,47.21871,"max@70","COUERON VERS ST HERBLAIN RD17"
6.06612,46.30657,"max@70","DOUBLE SENS RD1005"
3.37707,46.12851,"max@70","Gannat vers Vichy RD2209"
2.64596,46.30013,"max@70","MONTLUCON vers NERIS LES BAINS RD2144"
2.17169,43.96172,"max@70","Carmaux vers Albi RN88"
2.17115,43.96119,"max@70","Albi vers Carmaux RN88"
8.91863,41.66385,"max@70","DOUBLE SENS RN196"
9.1738,41.41069,"max@70","DOUBLE SENS RN198"
7.27639,43.7769,"max@70","Tourrette Levens vers Nice RD19"
2.95801,48.02818,"max@70","DOUBLE SENS RD2060"
1.84459,47.87434,"max@70","DOUBLE SENS RD951"
0.20027,47.97951,"max@70","LE MANS VERS TOURS RD338"
1.29675,47.55821,"max@70","DOUBLE SENS RD952"
0.82024,47.91463,"max@70","Le Mans vers Orléans RD357"
1.11844,46.05168,"max@70","Limoges vers Bellac RN147"
0.49934,46.84953,"max@70","chatellerault vers richelieu RD749"
2.21311,43.92146,"max@70","DOUBLE SENS RD999"
1.72017,48.97834,"max@70","limay vers septeuil RD983"
-1.61678,43.4126,"max@70","ST JEAN DE LUZ VERS BAYONNE RD810"
3.47466,49.83924,"max@70","ST QUENTIN vers GUISE RD1029"
0.33535,44.20466,"max@70","Lavardac vers Agen RD930"
0.29608,47.19126,"max@70","Tours vers Chinon RD751"
5.60383,43.857,"max@70","DOUBLE SENS RD4100"
1.34772,47.60314,"max@70","VENDOME VERS ROMORANTIN LANTHENAY RD956"
0.51414,44.87798,"max@70","DOUBLE SENS RD936E1"
1.69688,47.32982,"max@70","DOUBLE SENS RD724"
3.84185,43.59885,"max@70","LATTES VERS JUVIGNAC RD65"
-1.67347,46.71917,"max@70","AIZENAY VERS ST GILLES CROIX DE VIE RD6"
0.7545,47.9294,"max@70","ORLEANS VERS LE MANS RD357"
2.78397,50.30102,"max@70","LENS VERS ARRAS RD917"
0.1973,46.75884,"max@70","DOUBLE SENS RD347"
3.9347,49.0502,"max@70","EPERNAY VERS CHATEAU THIERRY RD3"
-61.15032,14.65764,"max@70","DOUBLE SENS RN2"
-61.4683,16.40919,"max@70","DOUBLE SENS RN8"
2.25972,48.89299,"max@70","PUTEAUX vers ASNIERES SUR SEINE RD7"
2.25471,48.61327,"max@70","ARPAJON vers MONTLHERY RN20"
6.6323,43.46272,"max@70","FREJUS VERS LE MUY RDN7"
5.88493,46.04423,"max@70","DOUBLE SENS RD1508"
4.89128,45.72364,"max@70","MARSEILLE VERS PARIS RD383"
4.75631,45.82676,"max@70","MACON VERS LYON RN6"
7.32214,48.2691,"max@70","DOUBLE SENS RN59"
-0.32432,43.30411,"max@70","TARBES vers BAYONNE RD817"
1.78127,49.45887,"max@70","DOUBLE SENS RN31"
3.08575,50.63442,"max@70","LILLE VERS MONS EN BAROEUL RN356"
7.71674,48.45279,"max@70","DOUBLE SENS RD468"
6.46116,46.34075,"max@70","BONS EN CHABLAIS VERS THONON LES BAINS RD903"
9.48231,42.6111,"max@70","DOUBLE SENS RTE LIDO DE MARANA FACE ENTREE ILE DE SAN DAMIANO"
9.26942,41.58136,"max@70","DOUBLE SENS RN198"
4.39633,44.62108,"max@70","DOUBLE SENS RN102"
7.34902,43.72653,"max@70","MONACO VERS NICE RD6007"
-1.49589,47.26192,"max@70","ANGERS vers NANTES Route de Paris, face au 6, Rue du Danemark"
-0.0178,48.74911,"max@70","ARGENTAN VERS DREUX RD926"
3.88627,49.2731,"max@70","SOISSONS VERS REIMS RN31"
-1.96884,47.11228,"max@70","DOUBLE SENS RD751"
0.55254,46.76202,"max@70","DOUBLE SENS RD749"
0.13223,43.33898,"max@70","RABASTENS VERS TARBES RN21"
7.38571,47.59928,"max@70","ST LOUIS VERS ALTKIRCH RD419"
-2.60988,48.50839,"max@70","ERQUY VERS ST BRIEUC RD786"
-0.75166,45.73516,"max@70","DOUBLE SENS RD728"
1.42664,49.75073,"max@70","DOUBLE SENS RD1314"
2.23885,48.89171,"max@70","PARIS VERS ORGEVAL A14"
0.54927,47.56488,"max@70","LE MANS VERS TOURS RD938"
9.39674,41.96023,"max@70","BONIFACIO VERS BASTIA RT10"
2.37065,48.71969,"max@70","PARIS VERS EVRY RN7"
1.97145,47.86329,"max@70","DOUBLE SENS RD951"
-1.73712,48.49035,"max@70","DOL DE BRETAGNE vers COMBOURG RD795"
-2.01525,48.61624,"max@70","DINARD VERS ST MALO RD168"
3.28416,49.83832,"max@70","DOUBLE SENS RD1029"
0.74669,47.36909,"max@70","DOUBLE SENS RD976"
2.29052,48.90645,"max@70","COURBEVOIE VERS GENNEVILLIERS RD7 - QUAI DU DOCTEUR DERVAUX N 63 - 65"
-0.33271,49.18944,"max@70","CHERBOURG OCTEVILLE VERS PARIS RN814"
2.15622,48.78416,"max@70","NANTERRE vers CRETEIL A86"
2.15623,48.78416,"max@70","NANTERRE vers CRETEIL A86"
2.15621,48.78416,"max@70","NANTERRE vers CRETEIL A86"
2.16325,48.79863,"max@70","NANTERRE vers CRETEIL A86"
2.16324,48.79863,"max@70","NANTERRE vers CRETEIL A86"
2.16326,48.79863,"max@70","NANTERRE vers CRETEIL A86"
2.16323,48.79863,"max@70","CRETEIL vers NANTERRE A86"
2.16322,48.79863,"max@70","CRETEIL vers NANTERRE A86"
2.16321,48.79863,"max@70","CRETEIL vers NANTERRE A86"
2.15925,48.81291,"max@70","NANTERRE vers CRETEIL A86"
2.15926,48.81291,"max@70","NANTERRE vers CRETEIL A86"
2.15922,48.81291,"max@70","CRETEIL vers NANTERRE A86"
2.15924,48.81291,"max@70","NANTERRE vers CRETEIL A86"
2.15923,48.81291,"max@70","CRETEIL vers NANTERRE A86"
2.15921,48.81291,"max@70","CRETEIL vers NANTERRE A86"
2.14807,48.83101,"max@70","NANTERRE vers VERSAILLES A86"
2.14804,48.83101,"max@70","NANTERRE vers VERSAILLES A86"
2.14805,48.83101,"max@70","NANTERRE vers VERSAILLES A86"
2.14803,48.83101,"max@70","VERSAILLES vers NANTERRE A86"
2.14801,48.83101,"max@70","VERSAILLES vers NANTERRE A86"
2.14802,48.83101,"max@70","VERSAILLES vers NANTERRE A86"
2.14526,48.83959,"max@70","Rueil vers Versailles A86"
2.14525,48.83959,"max@70","Rueil vers Versailles A86"
2.14523,48.83959,"max@70","Versailles vers Rueil A86"
2.14524,48.83959,"max@70","Rueil vers Versailles A86"
2.14522,48.83959,"max@70","Versailles vers Rueil A86"
2.14521,48.83959,"max@70","Versailles vers Rueil A86"
2.15606,48.85599,"max@70","Rueil vers Versailles A86"
2.15605,48.85599,"max@70","Rueil vers Versailles A86"
2.15604,48.85599,"max@70","Rueil vers Versailles A86"
2.15603,48.85599,"max@70","Versailles vers Rueil A86"
2.15602,48.85599,"max@70","Versailles vers Rueil A86"
2.15601,48.85599,"max@70","Versailles vers Rueil A86"
2.15813,48.86913,"max@70","VERSAILLES VERS RUEIL A86"
2.15811,48.86913,"max@70","VERSAILLES VERS RUEIL A86"
2.15812,48.86913,"max@70","Versailles vers Rueil A86"
-0.40966,44.98321,"max@70","ST ANDRE DE CUBZAC VERS LIBOURNE RD670"
6.68451,45.17163,"max@70","Italie vers France A43"
6.68507,45.18901,"max@70","France vers Italie A43"
-0.29703,46.57141,"max@70","PARTHENAY VERS NIORT RD743"
2.45083,48.78988,"max@70","CRETEIL VERS MAISONS ALFORT RD1"
3.50326,45.201,"max@70","LE PUY EN VELAY vers BRIOUDE RN102"
3.50128,45.20341,"max@70","BRIOUDE vers LE PUY EN VELAY RN102"
2.72746,47.01205,"max@70","NEVERS VERS BOURGES RD976"
-2.31011,47.28251,"max@70","St NAZAIRE VERS LA BAULE VC 'Le pont de terre' (ex PR 0+710 de l'ex RD392D)"
2.31196,47.28299,"max@70","LA BAULE vers ST NAZAIRE VC 'Le pont de terre' (ex PR 0+845 de l'ex RD392D)"
2.72294,47.01292,"max@70","Bourges vers Nevers RD976"
0.81176,49.6328,"max@70","YVETOT vers TOTES RD929"
5.05967,43.87427,"max@70","APT vers AVIGNON RD900"
2.9916,49.2345,"max@70","SOISSONS vers PARIS RN2"
0.81157,49.63277,"max@70","TOTES vers YVETOT RD929"
5.05697,43.87456,"max@70","AVIGNON vers APT RD900"
4.94792,43.93515,"max@70","VEDENE vers CAUMONT SUR DURANCE RD6"
3.74108,46.62812,"max@70","CHEVAGNES VERS MALTAT RD973"
55.39237,-20.88539,"max@70","STE MARIE VERS ST DENIS RN2"
55.48889,-20.88672,"max@70","ST DENIS VERS ST BENOIT RN2"
6.08086,44.60632,"max@70","GRENOBLE vers GAP RN85"
3.43991,48.18511,"max@70","Sens vers Troyes RD660"
4.79765,44.11945,"max@70","Roquemaure vers Orange RD976"
4.43,45.43425,"max@70","FIRMINY VERS LYON RN88"
5.94337,45.77706,"max@70","AIX LES BAINS vers ANNECY RD1201"
4.8175,45.73316,"max@70","LYON VERS MARSEILLE A7"
3.07982,46.03179,"max@70","COMBRONDE vers ST PARDOUX RD2144"
-0.29389,48.14601,"max@70","DOUBLE SENS RD32"
5.29262,47.66106,"max@70","Langres vers Dijon RD974"
3.93317,46.1243,"max@70","DOUBLE SENS RN7"
4.87068,48.64668,"max@70","VITRY LE FRANCOIS vers ST DIZIER RN4"
-0.41606,47.41955,"max@70","DOUBLE SENS RD952"
7.80801,48.6403,"max@70","DOUBLE SENS Route de Wantzenau, angle Allée de Honau"
2.1123,48.83428,"max@70","VERSAILLES vers ST GERMAIN EN LAYE RD186"
1.27666,45.86655,"max@70","A20 vers Limoges Boulevard Schuman"
2.53056,45.4405,"max@70","BORT LES ORGUES VERS CLERMONT FERRAND RD922"
4.29001,43.77856,"max@70","NIMES vers LUNEL RN113"
3.92935,50.2808,"max@70","MAUBEUGE VERS VALENCIENNES RN49"
-0.98779,48.84027,"max@70","ST SEVER vers VIRE RD524"
-0.79759,49.21588,"max@70","DOUBLE SENS RD572"
1.87873,43.09628,"max@70","CARCASSONNE vers FOIX RD119"
5.59955,46.16113,"max@70","DOUBLE SENS RD1084"
7.12821,48.28282,"max@70","ST DIE DES VOSGES VERS SELESTAT RN159"
1.15898,45.98402,"max@70","DOUBLE SENS RN147"
-2.73691,47.76268,"max@70","DOUBLE SENS RD778"
0.69377,44.17174,"max@70","AGEN vers TOULOUSE RD813"
0.61949,44.16142,"max@70","LAYRAC vers AGEN RN21"
1.73202,46.82028,"max@70","Diors vers Châteauroux RD925"
0.13505,45.63016,"max@70","ST MICHEL vers ANGOULEME RD1000"
1.81982,50.1519,"max@70","ABBEVILLE VERS BOULOGNE RD1001"
4.65974,48.70589,"max@70","Nancy vers Paris RN4"
2.73883,47.97485,"max@70","MONTARGIS vers SOLTERRE RD2007"
0.92967,49.10434,"max@70","Lisieux vers Evreux RD613"
0.75447,49.22647,"max@70","Rouen vers Brionne RD438"
1.28544,49.17172,"max@70","Gaillon vers Louviers RD6015"
-1.4162,46.7049,"max@70","DOUBLE SENS RD37"
7.17282,48.26081,"max@70","SéLESTAT VERS ST DIé RN159"
-1.63717,43.36958,"max@70","DOUBLE SENS RD918"
-1.71314,43.36192,"max@70","DOUBLE SENS RD810"
5.96159,47.22213,"max@70","DOLE VERS MONTBELIARD RD673"
-1.52083,47.25373,"max@70","RENNES vers CHOLET RN844"
-1.90234,48.64734,"max@70","DOUBLE SENS RD155"
-2.08541,47.70159,"max@70","La Gacilly vers Redon RD873"
5.86711,43.13211,"max@70","OLLIOULES vers TOULON RDN8"
4.09434,45.73826,"max@70","Feurs vers Boën RD1089"
5.65375,47.7759,"max@70","DOUBLE SENS RN19"
5.05021,48.13863,"max@70","Blaisy vers Jonchery RD619"
5.03098,48.60302,"max@70","ST DIZIER vers CHAUMONT RN67"
4.36034,48.94732,"max@70","TROYES VERS CHALONS EN CHAMPAGNE RD3"
4.03263,49.22972,"max@70","REIMS VERS EPERNAY RD951"
2.03059,43.56791,"max@70","DOUBLE SENS RD926"
4.41479,46.70356,"max@70","CHALON SUR SAONE VERS MONTCEAU LES MINES RN70"
6.72747,47.89996,"max@70","DOUBLE SENS RN66"
1.15088,44.12468,"max@70","DOUBLE SENS RD927"
7.1977,43.68571,"max@70","DIGNE LES BAINS VERS NICE RD6202"
55.48368,-20.88632,"max@70","ST DENIS vers STE MARIE RN2"
-0.46651,46.26278,"max@70","DOUBLE SENS RD650"
7.06149,43.60445,"max@70","ANTIBES VERS VALBONNE RD35"
-1.52397,43.49391,"max@70","BAYONNE VERS BIARRITZ Bld du BAB face au centre URBEGUI"
-60.98237,14.52809,"max@70","STE LUCE VERS DUCOS RN5"
5.1565,48.37656,"max@70","CHAUMONT VERS ST DIZIER RN67"
1.42767,45.22226,"max@70","OBJAT vers BRIVE LA GAILLARDE RD901"
1.7618,47.93455,"max@70","BUCY ST LIPHARD vers COULMIERS RD2157"
2.10876,50.803,"max@70","DOUBLE SENS RD943"
-1.93972,47.76133,"max@70","DOUBLE SENS RD177"
5.35584,45.56784,"max@70","DOUBLE SENS RD1006"
2.41399,48.86087,"max@70","INTERIEUR BP-PORTE DE BAGNOLET"
2.28062,48.83241,"max@70","INTERIEUR BP-PORTE DE SEVRES"
2.28803,48.88572,"max@70","INTERIEUR BP-PORTE CHAMPERRET"
2.15161,48.8268,"max@70","VERSAILLES VERS VAUCRESSON RD182"
-0.99235,46.31879,"max@70","DOUBLE SENS RD137"
1.41633,47.53431,"max@70","BLOIS vers ROMORANTIN LANTHENAY RD765"
1.2005,49.4454,"max@70","DOUBLE SENS RN31"
4.18885,44.35989,"max@70","DOUBLE SENS RD104"
2.3331,44.52474,"max@70","DOUBLE SENS RD840"
3.45748,46.17012,"max@70","VICHY VERS VARENNES RD2209"
3.03571,49.24496,"max@70","SOISSONS vers PARIS RN2"
8.77188,41.98769,"max@70","DOUBLE SENS RD81"
1.98503,48.77026,"max@70","PARIS VERS CHARTRES RN10"
1.14532,49.45188,"max@70","ABBEVILLE VERS ROUEN RN28"
2.76366,48.15247,"max@70","NEMOURS VERS CHALETTE SUR LOING RD2007"
6.08709,46.05159,"max@70","CRUSEILLES VERS ST JULIEN EN GENEVOIS RD1201"
-1.85438,47.19506,"max@70","DOUBLE SENS RD723"
-1.73999,47.13053,"max@70","CHOLET vers RENNES RN844"
7.20722,43.66582,"max@70","ANTIBES VERS VILLEFRANCHE SUR MER RD6098"
2.26472,48.88333,"max@70","PORTE MAILLOT VERS PONT DE NEUILLY RN13"
-0.55534,44.88349,"max@70","PARIS VERS BORDEAUX A630"
4.84233,46.78971,"max@70","AUXERRE VERS MACON RD906"
6.51932,45.4932,"max@70","MOUTIERS vers ALBERTVILLE RN90"
4.80266,45.76357,"max@70","PARIS VERS LYON A6"
0.31546,47.80291,"max@70","CHATEAU DU LOIR VERS LE MANS RD338"
2.39613,48.89004,"max@70","EXTERIEUR BP-PANTIN"
4.83825,46.31121,"max@70","CHALON SUR SAONE VERS LYON RD906"
2.30974,48.89645,"max@70","PERIPHERIQUE EXTERIEUR BP-CLICHY"
0.35564,46.62896,"max@70","CHATELLERAULT VERS POITIERS RD910"
2.25437,48.8543,"max@70","EXTERIEUR BP-PTE PASSY"
-0.423377,46.827144,"max@70","MAULEON vers PARTHENAY RN149"
4.5832,48.767,"max@70","CHALONS EN CHAMPAGNE vers VITRY LE FRANCOIS RN44"
1.0742,47.796,"max@70","TOURS vers PARIS RN10"
4.8527,46.894,"max@70","CHALON SUR SAONE vers DEMIGNY RD19"
2.31005,48.82352,"max@70","EXTERIEUR BP-CHATILLON"
6.1594,47.633,"max@70","BELFORT vers LANGRES RN19"
-0.0572,46.191,"max@70","MELLE vers CIVRAY RD948"
4.3962,46.701,"max@70","CHALON SUR SAONE vers PARAY LE MONIAL RN70"
0.5038,45.851,"max@70","LIMOGES vers ANGOULEME RN141"
6.0052,46.001,"max@70","FRANGY vers ANNECY RD1508"
2.37965,48.822,"max@70","INTERIEUR BP-QUAI D'IVRY"
7.5412,48.339,"max@70","SELESTAT vers STRASBOURG RD1083"
1.62584,50.7029,"max@70","A16 vers PORT DE BOULOGNE RN416"
1.0737,47.797,"max@70","PARIS vers TOURS RN10"
-0.0571,46.299,"max@70","POITIERS vers MELLE RD950"
2.24157,48.8869,"max@70","ST GERMAIN EN LAYE VERS PARIS RN13"
2.2516,48.88743,"max@70","PROVINCE VERS PARIS RN1014"
-0.54887,47.48393,"max@70","ANGERS VERS NANTES RD323"
-0.65743,43.57649,"max@70","DOUBLE SENS RD933S"
4.42415,48.91581,"max@70","CHALONS EN CHAMPAGNE vers VITRY LE FRANCOIS RN44"
-1.60916,47.180606,"max@70","ST SEBASTIEN SUR LOIRE vers ST HERBLAIN RN 844"
6.8748,45.889,"max@70","Italie vers France RN205 -tunnel du Mont Blanc- Point Métrique 1726m"
6.9024,45.863,"max@70","Italie vers France RN205 -tunnel du Mont Blanc- Point Métrique 5324m"
-1.622631,47.203266,"max@70","ORVAULT vers BOUGUENAIS RN844"
6.91082,45.85587,"max@70","France vers Italie RN205 -tunnel du Mont Blanc- Point Métrique 6245m"
6.8611,45.901,"max@70","France vers Italie RN205 (tunnel du Mont Blanc) Point Métrique 2052m"
3.9189,43.586,"max@70","MONTPELLIER vers LATTES Av Frêche, 160 m en amont du chemin de Soriech"
6.0651,43.252,"max@70","CUERS vers ROCBARON RD43"
3.4578,49.618,"max@70","LAON vers ST QUENTIN RD1044"
-61.04235,14.60745,"max@70","LE LAMENTIN vers FORT DE FRANCE RN9"
-61.04224,14.60795,"max@70","FORT DE FRANCE vers LE LAMENTIN RN9"
6.06709,49.2385,"max@70","STE MARIE AUX CHENES vers ROMBAS RD181"
6.2291,46.181,"max@70","CHAMONIX MONT BLANC vers MACON A40"
3.2523,49.036,"max@70","MONTREUIL AUX LIONS vers CHATEAU THIERRY RD 1003 (ex RN 3)"
1.53482,48.8465,"max@70","DOUBLE SENS RD933"
6.48663,43.49302,"max@70","DOUBLE SENS RD555"
-1.53663,43.48705,"max@70","BIARRITZ VERS BAYONNE Bd du B.A.B (hauteur n°4 de la rue Marie BLANQUE)"
3.2612,48.171,"max@70","DOUBLE SENS RD72"
-0.0563,46.191,"max@70","SAUZE VAUSSAIS vers MELLE RD948"
7.243083,43.692385,"max@70","Nice vers St Laurent du Var Voie Mathis hauteur de la bretelle d'entrée Bellet"
7.128745,43.680891,"max@70","Vence vers Cagnes sur Mer RD336"
6.73921,45.58267,"max@70","BOURG ST MAURICE vers MOUTIERS RN90"
1.2355,48.068,"max@70","DOUBLE SENS RD927"
6.7025,47.465,"max@70","DOUBLE SENS RD126"
6.5583,47.132,"max@70","BESANCON vers MORTEAU RD461"
6.8415,47.459,"max@70","DOUBLE SENS RD437"
6.7248,47.503,"max@70","ARCEY vers MONTBELIARD RD33"
-3.1479,48.313,"max@70","ROSTRENEN vers ST BRIEUC RD790"
5.7408,43.156,"max@70","ST CYR vers BANDOL RD559"
2.1795,48.792,"max@70","VELIZY VILLACOUBLAY vers VIROFLAY RD53"
2.2466,49.367,"max@70","DOUBLE SENS RD12"
5.78997,45.05042,"max@70","LE BOURG D OISANS vers VIZILLE RD1091"
6.4331,46.347,"max@70","PEROLS vers MONTPELLIER RD66 (Avenue Pierre Mendès-France)"
3.9227,43.607,"max@70","MONTPELLIER vers PEROLS RD66 (Avenue Pierre Mendès-France)"
7.73904,48.57066,"max@70","STRASBOURG VERS PARIS RN4"
2.27976,48.67029,"max@70","PARIS VERS MONTLHERY RN20"
5.9509,43.12053,"average@70","La seyne sur Mer vers La valette du var A50"
4.98498,47.33677,"average@70","TALANT vers PLOMBIERES LES DIJON RN274"
-0.34774,43.3289,"average@70","IDRON VERS LESCAR RD817"
7.3822,43.73209,"average@70","EZE vers CAP D AIL RM6007"
2.20352,48.83954,"average@70","PARIS vers PROVINCE A13"
1.89779,48.69801,"average@70","CERNAY LA VILLE vers AUFFARGIS RD24"
1.90362,48.71148,"average@70","SENLISSE vers LES ESSARTS LE ROI RD202"
4.1625,46.51361,"average@70","MONTCEAU LES MINES vers MONTCHANIN RN70"
5.91416,43.12706,"average@70","LA VALETTE DU VAR vers LA SEYNE SUR MER A50"
2.20355,48.83963,"average@70","PROVINCE vers PARIS A13"
-2.1784,47.2986,"average@70","St Brevin les Pins vers Saint Nazaire (Sud / Nord) RD 213"
4.11727,44.1597,"average@70","SALINDRES vers ALES RD16"
4.1417,44.17134,"average@70","ALES vers SALINDRES RD16"
-2.178384,47.297645,"average@70","St Nazaire vers St Brevin les Pins  (Nord / Sud) RD 213"
6.010006,47.215305,"average@70","Vallorbe vers Nancy RN57"
